set binlog_format=ROW;
flush logs;
use test;

******* no-ddl test

xxx 1.test flashback insert sql
create table t1 (a int);
create table t2 (b int);
before:
select * from t1;
a
insert into t1 value (1);
insert into t2 value (1);
after insert:
select * from t1;
a
1
select * from t2;
b
1
flush logs;
after flashback:
select * from t1;
a
select * from t2;
b
1
drop table t1;
drop table t2;
xxx

xxx 2.test flashback delete sql
create table t1 (a int);
create table t2 (b int);
insert into t1 value (1);
insert into t2 value (1);
before:
select * from t1;
a
1
select * from t2;
b
1
delete from t1 where a=1;
delete from t2 where b=1;
after delete:
select * from t1;
a
select * from t2;
b
flush logs;
after flashback:
select * from t1;
a
1
select * from t2;
b
drop table t1;
drop table t2;
xxx

xxx3.test flashback update sql
create table t1 (a int);
create table t2 (b int);
insert into t1 value (1);
insert into t2 value (2);
before:
select * from t1;
a
1
select * from t2;
b
2
update t1 set a=2;
update t2 set b=2;
after update:
select * from t1;
a
2
select * from t2;
b
2
flush logs;
after flashback:
select * from t1;
a
1
select * from t2;
b
2
drop table t1;
drop table t2;
xxx

